MSI,RX 580,MSI Radeon RX 580 DirectX 12 RX 580 ARMOR 4G OC 4GB 256-Bit GDDR5 PCI Express x16 HDCP Ready CrossFireX Support Video Card,$299.99 (2 Offers)–,4.0,Free Shipping,https://www.newegg.com/msi-radeon-rx-580-rx-580-armor-4g-oc/p/N82E16814137120?Description=RX,1366 MHz,MSI,"10.59"" x 4.92""",AMD,Double Fans,NONE,"Crossfire, 2-Way (Bridgeless)",1 x DVI-D,4-May-19,DirectX 12,2 x DisplayPort,NONE,NONE,7000 MHz,NONE,"Armor 2X Thermal Design- TORX Fan:Dispersion fan blade: Steep curved blade accelerating the airflow.Traditional fan blade: Provides steady airflow to massive heat sink below.- Zero Frozr: Stopping the fan in low-load situations, keeping a noise-free environment.- Advanced Airflow Control technology: Improves cooling efficiency by using advanced aerodynamics to focus airflow.Afterburner Overclocking Utility- Wireless control through Android/iOS devices.- Predator: In-game video recording.- Kombustor: DirectX12 benchmark.- Supports multi-GPU setups.Military Class 4 Components- Certified to MIL-STD-810G standards for top stability and quality.- Built with Hi-c CAP, Solid CAP, and New SFC components.",NONE,Radeon RX 580,AMD Radeon RX 500 Series,Yes,2 x HDMI,PCI Express x16,NONE,NONE,269 mm,NONE,256-Bit,4GB,GDDR5,RX 580 ARMOR 4G OC,5,OpenGL 4.5,NONE,NONE,"""THIS IS A REFURBISHED ITEM AND IT MIGHT HAVE SCRATCHES, BLEMISHES, AND OTHER IMPERFECTIONS => SEE POSTED IMAGES! ADDITIONALLY, THIS ITEM MIGHT HAVE SIGNS OF HANDLING, REPAIR, AND TESTING AS REQUIRED BY THE REFURBISHING PROCESS! MOTHERBOARD COMES IN PLAIN OEM NON-RETAIL BOX WITHOUT ANY ACCESSORIES AS PICTURED! IF ITS NOT PICTURED => ITS NOT INCLUDED!""",8-Pin,NONE,NONE,Dual Slot,2304 Stream Processors,Recommended PSU: 500W,185W,NONE,Yes,291 (90% Positive),268.986,124.96799999999999
XFX,RX 580,XFX Radeon RX 580 DirectX 12 RX-580P8DFD6 XXX Edition 8GB 256-Bit GDDR5 PCI Express 3.0 CrossFireX Support Video Card,$269.99 (2 Offers)–,,Free Shipping,https://www.newegg.com/xfx-radeon-rx-580-rx-580p8dfd6/p/27N-0002-000P6?Description=RX,NONE,XFX,"10.63"" x 4.88""",AMD,NONE,True: 1366 MHz OC+: 1386 MHz,Yes,1 x DL-DVI-D,18-Dec-19,DirectX 12,3 x DisplayPort 1.4,Yes,NONE,True: 8 GHz OC+: 8.1 GHz,Yes,3 Years with Registration at XFX  Microsoft Windows 10 Support  FinFET 14nm Technology  GCN 4th Generation Architecture  AMD Virtual Super Resolution (VSR)  AMD Relive  AMD Chill  AMD LiquidVR Technology  AMD FreeSync 2 Technology  AMD Frame Rate Target Control (FRTC)  AMD Eyefinity multi-display technology  AMD App Acceleration  AMD XConnect Ready  AMD Radeon Crimson Software  AMD WattMan  AMD APP Acceleration  Dolby TrueHD and DTS-HD Master Audio Support  Up to 6 displays supported (may require the use of MST Hubs)  Advanced GDDR5 Memory Technology  Vulkan and Mantle Ready. Next Generation APIs  OpenCL Support,NONE,Radeon RX 580,AMD Radeon RX 500 Series,NONE,1 x HDMI 2.0b,PCI Express 3.0,NONE,NONE,270 mm,4096 x 2160,256-Bit,8GB,GDDR5,RX-580P8DFD6,NONE,OpenGL 4.5,NONE,NONE,Accessories: 8-pin to 6-pin power cable Driver Disk Installation Guide Installation DVD,8-Pin,Yes,NONE,Dual Slot,2304 Stream Processors,Minimum Power Supply Requirement: 500W XFX Recommended Power Supply: XFX 550W PSU,185W,Yes,Yes,"2,687 (88% Positive)",270.002,123.95199999999998
ASUS,RX 580,ASUS Radeon RX 580 O4G Dual-fan OC Edition GDDR5 DP HDMI DVI VR Ready AMD Graphics Card (DUAL-RX580-O4G),$462.87 –,4.0,Free Shipping,https://www.newegg.com/asus-radeon-rx-580-dual-rx580-o4g/p/N82E16814126196?Description=RX,1380 MHz (OC Mode)1360 MHz (Gaming Mode),ASUS,"9.53"" x 5.07""",AMD,Double Fans,NONE,Yes,1 x DVI-D,6-Feb-19,DirectX 12,2 x DisplayPort 1.4,NONE,NONE,7000 MHz,Yes,ASUS Dual series Radeon RX 580 OC edition 4GB GDDR5 for best eSports and 4K gaming- 1380 MHz Boost Clock in OC mode for outstanding performance and gaming experience.- Unique Wing-Blade 0dB Fans for max air flow with 105% more air pressure. Play in silence with 0dB fans.- IP5X-Certified Fans are dust resistant for longer fan lifespan.- Industry Only Auto-Extreme Technology with Super Alloy Power II delivers premium quality and best reliability.- VR-friendly HDMI Ports for immersive virtual reality experiences.- GPU Tweak II with Xsplit Gamecaster provides intuitive performance tweaking and instant gameplay streaming.,NONE,Radeon RX 580,AMD Radeon RX 500 Series,2.2,2 x HDMI 2.0b,NONE,NONE,NONE,242 mm,7680 x 4320,256-Bit,4GB,GDDR5,DUAL-RX580-O4G,NONE,OpenGL 4.5,NONE,NONE,Accessories:1 x CD1 x Quick Guide,8-Pin,NONE,Dual,Dual Slot,2304 Stream Processors,NONE,185W,NONE,Yes,-19,242.06199999999998,128.778
GIGABYTE,RX 580,GIGABYTE AORUS Radeon RX 580 DirectX 12 GV-RX580AORUS-4GD 4GB 256-Bit GDDR5 PCI Express 3.0 x16 CrossFireX Support ATX Video Card,$386.99 –,4.0,Free Shipping,https://www.newegg.com/gigabyte-radeon-rx-580-gv-rx580aorus-4gd/p/N82E16814125963?Description=RX,OC mode: 1380 MHzGaming mode: 1365 MHz,GIGABYTE,"9.13"" x 4.76""",AMD,WINDFORCE 2X,NONE,Yes,1 x Dual-Link DVI-D,11-Jan-19,DirectX 12,3 x DisplayPort 1.4,Yes,NONE,7000 MHz,Yes,Powered by Radeon RX 580WINDFORCE 2X with 90mm Blade Fan DesignAdvanced Copper Back Plate CoolingRGB fusion - 16.7M customizable color lightingStylish Metal Back PlateIntuitive AORUS Graphics Engine,ATX,Radeon RX 580,AMD Radeon RX 500 Series,NONE,1 x HDMI 2.0,PCI Express 3.0 x16,NONE,NONE,232 mm,7680 x 4320,256-Bit,4GB,GDDR5,GV-RX580AORUS-4GD,5,OpenGL 4.5,NONE,NONE,Accessories:Graphics card quick guideAORUS metal stickerDriver CD,8-Pin,NONE,AORUS,Dual Slot,2304 Stream Processors,System PSU Limitation: 500W,185W,NONE,Yes,0 reviews,231.90200000000002,120.90399999999998
GIGABYTE,RX 580,GIGABYTE Radeon RX 580 DirectX 12 GV-RX580GAMING-4GD 4GB 256-Bit GDDR5 PCI Express 3.0 x16 CrossFireX Support ATX Video Card,$402.99 –,4.0,Free Shipping,https://www.newegg.com/gigabyte-radeon-rx-580-gv-rx580gaming-4gd/p/N82E16814125964?Description=RX,1355 MHz (OC Mode) / 1340 MHz (Gaming Mode),GIGABYTE,"9.13"" x 4.57""",AMD,WINDFORCE 2X,NONE,Yes,1 x Dual-Link DVI-D,3-Jan-19,DirectX 12,3 x DisplayPort 1.4,Yes,NONE,7000 MHz,Yes,Powered by Radeon RX 580WINDFORCE 2X with 90mm Blade Fan DesignRGB fusion - 16.8M customizable color lightingStylish Metal Back PlateIntuitive AORUS Graphics Engine,ATX,Radeon RX 580,AMD Radeon RX 500 Series,NONE,1 x HDMI 2.0,PCI Express 3.0 x16,NONE,NONE,232 mm,7680 x 4320,256-Bit,4GB,GDDR5,GV-RX580GAMING-4GD,5,OpenGL 4.5,NONE,NONE,NONE,8-Pin,NONE,NONE,Dual Slot,2304 Stream Processors,System PSU Limitation: 500W,185W,NONE,Yes,0 reviews,231.90200000000002,116.078
GIGABYTE,RX 580,GIGABYTE AORUS Radeon RX 580 DirectX 12 GV-RX580AORUS-8GD 8GB 256-Bit GDDR5 PCI Express 3.0 x16 CrossFireX Support ATX Video Card,$428.99 –,4.0,Free Shipping,https://www.newegg.com/gigabyte-radeon-rx-580-gv-rx580aorus-8gd/p/N82E16814125961?Description=RX,NONE,GIGABYTE,"9.13"" x 4.76""",AMD,WINDFORCE 2X,1380 MHz (OC Mode) / 1365 MHz (Gaming Mode),Yes,1 x Dual-Link DVI-D,26-Nov-18,DirectX 12,3 x DisplayPort 1.4,Yes,NONE,8000 MHz,Yes,Powered by Radeon RX 580WINDFORCE 2X with 90mm Blade Fan DesignAdvanced Copper Back Plate CoolingRGB fusion - 16.8M customizable color lightingStylish Metal Back Plate Intuitive AORUS Graphics Engine,ATX,Radeon RX 580,AMD Radeon RX 500 Series,NONE,1 x HDMI 2.0,PCI Express 3.0 x16,NONE,NONE,232 mm,7680 x 4320,256-Bit,8GB,GDDR5,GV-RX580AORUS-8GD,5,OpenGL 4.5,NONE,NONE,Accessories:Graphics card quick guideAORUS metal stickerDriver CD,8-Pin,NONE,AORUS,Dual Slot,2304 Stream Processors,Recommended PSU: 500W,185W,NONE,Yes,0 reviews,231.90200000000002,120.90399999999998
Sapphire,RX 580,Sapphire Radeon Pulse RX 580 8GB GDDR5 Dual HDMI/ DVI-D/ Dual DP OC with Backplate (UEFI) PCI-E Graphics Card Graphic Cards,$299.99 –,,Free Shipping,https://www.newegg.com/radeon-rx-580-sapphire-tech-11265-05-20g/p/1FT-000B-000M4?Description=RX,1366 MHz,SAPPHIRE,NONE,AMD,NONE,NONE,NONE,NONE,28-Jul-20,DirectX 12,2 x DisplayPort 1.4,NONE,NONE,8000 MHz,NONE,Sapphire Features: Dual-X Cooling Long Life Dual Ball Bearing Fans Intelligent Fan Control III Quick Connect System Long Life Capacitor Backplate Black Diamond 4 Chokes Fuse protection  AMD Features: Radeon VR Ready Premium Radeon Software Radeon FreeSync Technology AMD LiquidVR Technology 4th Gen GCN Architecture Radeon Chill Radeon ReLive DirectX 12 Technology AMD Eyefinity Technology (Gaming) AMD App Acceleration AMD CrossFire Technology AMD CrossFire (Bridgeless) 3rd Gen 14nm Process Technology OpenCL 2.0 OpenGL 4.5 AMD PowerTune Technology TrueAudio Next Unified Video Decoder (UVD) Video Code Engine (VCE) Virtual Super Resolution The Vulkan API,NONE,Radeon RX 580,AMD Radeon RX 500 Series,NONE,2 x HDMI,PCI Express 3.0,NONE,NONE,NONE,NONE,256-Bit,8GB,GDDR5,Sapphire Tech 11265-05-20G,5,OpenGL 4.5,NONE,NONE,NONE,8-Pin,NONE,PULSE,NONE,2304 Stream Processors,NONE,NONE,NONE,NONE,0 reviews,0.0,0.0
MSI,RX 580,MSI Video Card RX 580 ARMOR 8G OC 8GB GDDR5 256Bit PCI Express,$314.85 –,,Free Shipping,https://www.newegg.com/msi-rx-580-armor-8g-oc/p/27N-0023-000P2?Description=RX,1366,MSI,"10.59"" x 4.92""",AMD,Double Fans,NONE,Yes,1 x DVI,3-Sep-20,DirectX 12,2 x DisplayPort,Yes,Air Cooler,8000,Yes,NONE,Plug-in CardFull-height,Radeon RX 580,AMD Radeon RX 500 Series,Yes,2 x HDMI,PCI Express 3.0 x16,No,Yes,269,NONE,256-Bit,8GB,GDDR5,RX 580 ARMOR 8G OC,5,OpenGL 4.5,NONE,ARMOR OC,NONE,8-Pin,Yes,ARMOR OC,Dual Slot,2304 Stream Processors,NONE,185W,Yes,Yes,0 reviews,268.986,124.96799999999999
GIGABYTE,RX 580,Refurb Gigabyte Radeon RX 580 Gaming 4GB Graphic Cards GV-RX580GAMING-4GD,$457.87 –,3.0,Free Shipping,https://www.newegg.com/gigabyte-radeon-rx-580-gv-rx580gaming-4gd/p/1B4-0116-00060?Description=RX,NONE,GIGABYTE,"9.13"" x 4.57""",AMD,WINDFORCE 2X,OC mode: 1355 MHzGaming mode: 1340 MHz,Yes,1 x Dual-link DVI-D,11-Dec-19,DirectX 12,3 x DisplayPort 1.4,NONE,NONE,7000 MHz,Yes,Powered by Radeon RX 580WINDFORCE 2X with 90mm Blade Fan DesignRGB fusion - 16.8M customizable color lightingStylish Metal Back PlateIntuitive AORUS Graphics Engine,ATX,Radeon RX 580,AMD Radeon RX 500 Series,NONE,1 x HDMI 2.0,PCI Express 3.0 x16,NONE,NONE,232 mm,7680 x 4320,256-Bit,4GB,GDDR5,GV-RX580GAMING-4GD,5,OpenGL 4.5,NONE,NONE,NONE,8-Pin,NONE,NONE,Dual Slot,2304 Stream Processors,Recommended PSU: 500W,300W,NONE,Yes,-2,231.90200000000002,116.078
MSI,RX 580,MSI Radeon RX 580 DirectX 12 Radeon RX 580 8G V1 8GB 256-Bit GDDR5 PCI Express x16 HDCP Ready CrossFireX Support Video Card,$179.99 –,4.0,Free Shipping,https://www.newegg.com/msi-radeon-rx-580-8g-v1/p/N82E16814137244?Description=RX,1340 MHz,MSI,"7.80"" x 4.41""",AMD,Single Fan,NONE,2-Way (Bridgeless),NONE,26-Oct-20,DirectX 12,3 x DisplayPort 1.4,NONE,NONE,8000 MHz,Yes,"All Solid Capacitors:10 years long lifetime under full load.Lower temperature and higher efficiency.Aluminum core for higher stability.Afterburner Overclocking Utility:Wireless control through Android/iOS devices.Predator: In-game video recording.Kombustor: built-in DirectX12 benchmark.AMD Eyefinity:Makes games more immersive by enabling you to play across multiple screens for an eye-popping gaming experience.AMD FreeSync:Synchronizes the display refresh to your Radeon RX Series GPU for the fast, smooth gaming.",NONE,Radeon RX 580,AMD Radeon RX 500 Series,2.2,1 x HDMI 2.0b,PCI Express x16,NONE,NONE,198 mm,NONE,256-Bit,8GB,GDDR5,Radeon RX 580 8G V1,4,OpenGL 4.5,NONE,NONE,NONE,8-Pin,NONE,NONE,Dual Slot,2304 Stream Processors,RECOMMENDED PSU: 500W,185W,NONE,Yes,-72,198.11999999999998,112.014
VisionTek,RX 580,VisionTek Radeon RX 580 DirectX 12 901103 8GB 256-Bit GDDR5 PCI Express 3.0 x16 Overclocked Edition Video Card,$199.99 –,3.0,Free Shipping,https://www.newegg.com/visiontek-radeon-rx-580-901103/p/N82E16814129327?Description=RX,1340 MHz (Boost)1366 MHz (Turbo),VisionTek,NONE,AMD,Double Fans,1257 MHz,NONE,1 x Dual-Link DVI,26-Oct-20,DirectX 12,3 x DisplayPort 1.4,Yes,NONE,NONE,NONE,Smooth 1440p in the latest AAA gamesDirectX 12 and Vulkan supportPremium Virtual Reality experienceFreeSync 2 and HDR gamingHDMI 2.0 and DisplayPort 1.4 HBR3,NONE,Radeon RX 580,AMD Radeon RX 500 Series,NONE,1 x HDMI 2.0b,PCI Express 3.0 x16,NONE,NONE,NONE,NONE,256-Bit,8GB,GDDR5,901103,5,NONE,"Supported operating systems include Linux, Windows 10, and Windows 7.64-bit operating system required.",NONE,NONE,8-Pin,NONE,NONE,Dual Slot,NONE,"PCI Express based PC is required with one X16 lane graphics slot available on the motherboard.500W (or greater) power supply with one 75W 8-pin PCI Express power connector recommended.Minimum 4GB of system memory 8GB (or more) system memory recommended for AMD CrossFire technology.Installation software requires CD-ROM drive, keyboard, mouse, and display.DVD playback requires DVD drive and a DVD.A display with digital input (HDMI, DisplayPort or DVI) is required.Blu-ray playback requires Blu-ray drive and a Blu-ray disc.",185W,NONE,Yes,-2,0.0,0.0
AMD,RX 580,AMD Radeon RX 580 8GB Dual Fan Black/Silver PCIe Video Gaming Graphics Card GPU,$139.99 –,,Free Shipping,https://www.newegg.com/coinmine-radeon-rx-580-grx58000s828g5-grx580coins828g5/p/27N-0018-000S9?Description=RX,NONE,Coinmine,NONE,AMD,Double Fans,NONE,NONE,2 x DVI,26-Oct-20,NONE,1 x DisplayPort,NONE,Air Cooler,NONE,NONE,NONE,NONE,Radeon RX 580,AMD Radeon RX 500 Series,NONE,1 x HDMI,PCI Express 3.0 x16,NONE,NONE,NONE,NONE,NONE,8GB,NONE,GRX58000S828G5 / GRX580COINS828G5,NONE,NONE,NONE,RX 580,NONE,NONE,NONE,Radeon,NONE,NONE,NONE,NONE,NONE,NONE,0 reviews,0.0,0.0
